{
  "annotations": [
    {
      "attrs": {
        "lang": "en-us"
      },
      "id": "annotation-000000",
      "kind": "language",
      "spoken_end": 14,
      "spoken_start": 0,
      "structural_end": 14,
      "structural_start": 0
    },
    {
      "attrs": {
        "lang": "fr",
        "tag": "lang"
      },
      "id": "annotation-000001",
      "kind": "inline",
      "spoken_end": 13,
      "spoken_start": 6,
      "structural_end": 13,
      "structural_start": 6
    }
  ],
  "boundaries": [],
  "config": {
    "diagnostics": true,
    "document_format": "ssmd",
    "language": "en-us",
    "language_aliases": {},
    "linguistics": {
      "require_spacy": false,
      "spacy_model": null,
      "spacy_model_size": null,
      "use_spacy": null
    },
    "overlap_mode": "snap",
    "pauses": {
      "clause": 0.3,
      "enabled": true,
      "mode": "tts",
      "paragraph": 1.0,
      "parenthetical": 0.15,
      "sentence": 0.6,
      "voice_change": 0.15,
      "weak": 0.15
    },
    "ssmd": {
      "parse_header": true,
      "pause_defaults": null,
      "strict_header": true,
      "unknown_header": "warn"
    },
    "text_preparation": "spokenform",
    "unit": "paragraph"
  },
  "diagnostics": [
    {
      "code": "planning.complete",
      "message": "Plan compiled without renderer or audio processing",
      "path": null,
      "severity": "info"
    }
  ],
  "document_metadata": {
    "header": {},
    "planning": {
      "engine_independent": true,
      "linguistic_passes": 2,
      "pass_a_tokens": 3
    }
  },
  "format": "utterplan",
  "languages": [
    {
      "id": "lang-0",
      "language": "en-us",
      "source": "explicit-span",
      "spoken_end": 6,
      "spoken_start": 0
    },
    {
      "id": "lang-1",
      "language": "fr",
      "source": "explicit-span",
      "spoken_end": 13,
      "spoken_start": 6
    },
    {
      "id": "lang-2",
      "language": "en-us",
      "source": "explicit-span",
      "spoken_end": 14,
      "spoken_start": 13
    }
  ],
  "markers": [],
  "plan_id": "sha256:46fed62d1e7126bf0f5f366358e802be45931a1f5a6b7158f24b51b97e298f16",
  "preparation": {
    "backend": "spokenform",
    "languages": ["en-us", "fr", "en-us"],
    "replacements": [],
    "version": "0.4.4.dev0+g71feb9cb4.d19800101",
    "warnings": []
  },
  "producer": {
    "name": "utterplan",
    "version": "0.1.0"
  },
  "schema_version": 1,
  "segments": [
    {
      "annotation_ids": ["annotation-000000"],
      "clause": 0,
      "directives": {},
      "id": "seg-000000",
      "language": "en-us",
      "paragraph": 0,
      "pause_after": {
        "events": [],
        "seconds": 0.0
      },
      "pause_before": {
        "events": [],
        "seconds": 0.0
      },
      "sentence": 0,
      "spoken_end": 5,
      "spoken_start": 0,
      "text": "Hello",
      "token_indices": [0]
    },
    {
      "annotation_ids": ["annotation-000000", "annotation-000001"],
      "clause": 0,
      "directives": {},
      "id": "seg-000001",
      "language": "fr",
      "paragraph": 0,
      "pause_after": {
        "events": [],
        "seconds": 0.0
      },
      "pause_before": {
        "events": [],
        "seconds": 0.0
      },
      "sentence": 0,
      "spoken_end": 13,
      "spoken_start": 6,
      "text": "Bonjour",
      "token_indices": [1]
    },
    {
      "annotation_ids": ["annotation-000000"],
      "clause": 0,
      "directives": {},
      "id": "seg-000002",
      "language": "en-us",
      "paragraph": 0,
      "pause_after": {
        "events": [],
        "seconds": 0.0
      },
      "pause_before": {
        "events": [],
        "seconds": 0.0
      },
      "sentence": 0,
      "spoken_end": 14,
      "spoken_start": 13,
      "text": ".",
      "token_indices": [2]
    }
  ],
  "source": {
    "format": "ssmd",
    "text": "Hello [Bonjour]{lang=\"fr\"}."
  },
  "texts": {
    "spoken": "Hello Bonjour.",
    "structural": "Hello Bonjour."
  },
  "tokens": [
    {
      "id": "token-0",
      "language": "en-us",
      "lemma": "hello",
      "spoken_end": 5,
      "spoken_start": 0,
      "text": "Hello"
    },
    {
      "id": "token-1",
      "language": "fr",
      "lemma": "bonjour",
      "spoken_end": 13,
      "spoken_start": 6,
      "text": "Bonjour"
    },
    {
      "id": "token-2",
      "language": "en-us",
      "lemma": ".",
      "spoken_end": 14,
      "spoken_start": 13,
      "text": "."
    }
  ],
  "units": [
    {
      "content_hash": "sha256:4865de3ee5a6940aa1414648bb9bd570eda6c3a20e33f3568e28d9d14bdbf3e4",
      "id": "unit-0000",
      "index": 0,
      "kind": "paragraph",
      "marker_ids": [],
      "segment_ids": ["seg-000000", "seg-000001", "seg-000002"],
      "spoken_end": 14,
      "spoken_start": 0
    }
  ],
  "warnings": []
}
