{
  "annotations": [
    {
      "attrs": {
        "lang": "en-us"
      },
      "id": "annotation-000000",
      "kind": "language",
      "spoken_end": 4,
      "spoken_start": 0,
      "structural_end": 4,
      "structural_start": 0
    },
    {
      "attrs": {
        "emphasis": "strong",
        "pitch": "+2st",
        "rate": "1.2",
        "tag": "prosody",
        "volume": "80%"
      },
      "id": "annotation-000001",
      "kind": "inline",
      "spoken_end": 4,
      "spoken_start": 0,
      "structural_end": 4,
      "structural_start": 0
    }
  ],
  "boundaries": [],
  "config": {
    "diagnostics": true,
    "document_format": "ssmd",
    "language": "en-us",
    "language_aliases": {},
    "linguistics": {
      "require_spacy": false,
      "spacy_model": null,
      "spacy_model_size": null,
      "use_spacy": null
    },
    "overlap_mode": "snap",
    "pauses": {
      "clause": 0.3,
      "enabled": true,
      "mode": "tts",
      "paragraph": 1.0,
      "parenthetical": 0.15,
      "sentence": 0.6,
      "voice_change": 0.15,
      "weak": 0.15
    },
    "ssmd": {
      "parse_header": true,
      "pause_defaults": null,
      "strict_header": true,
      "unknown_header": "warn"
    },
    "text_preparation": "spokenform",
    "unit": "paragraph"
  },
  "diagnostics": [
    {
      "code": "planning.complete",
      "message": "Plan compiled without renderer or audio processing",
      "path": null,
      "severity": "info"
    }
  ],
  "document_metadata": {
    "header": {},
    "planning": {
      "engine_independent": true,
      "linguistic_passes": 2,
      "pass_a_tokens": 1
    }
  },
  "format": "utterplan",
  "languages": [
    {
      "id": "lang-0",
      "language": "en-us",
      "source": "explicit-span",
      "spoken_end": 4,
      "spoken_start": 0
    }
  ],
  "markers": [],
  "plan_id": "sha256:8f9e0342d77491f1dfa04ba406705cbd33105e03abb34ffed30ac286c7d107b8",
  "preparation": {
    "backend": "spokenform",
    "languages": ["en-us"],
    "replacements": [],
    "version": "0.4.4.dev0+g71feb9cb4.d19800101",
    "warnings": []
  },
  "producer": {
    "name": "utterplan",
    "version": "0.1.0"
  },
  "schema_version": 1,
  "segments": [
    {
      "annotation_ids": ["annotation-000000", "annotation-000001"],
      "clause": 0,
      "directives": {
        "emphasis": {
          "level": "strong"
        },
        "prosody": {
          "pitch": "+2st",
          "rate": "1.2",
          "volume": "80%"
        }
      },
      "id": "seg-000000",
      "language": "en-us",
      "paragraph": 0,
      "pause_after": {
        "events": [],
        "seconds": 0.0
      },
      "pause_before": {
        "events": [],
        "seconds": 0.0
      },
      "sentence": 0,
      "spoken_end": 4,
      "spoken_start": 0,
      "text": "fast",
      "token_indices": [0]
    }
  ],
  "source": {
    "format": "ssmd",
    "text": "[fast]{rate=\"1.2\" pitch=\"+2st\" volume=\"80%\" emphasis=\"strong\"}"
  },
  "texts": {
    "spoken": "fast",
    "structural": "fast"
  },
  "tokens": [
    {
      "id": "token-0",
      "language": "en-us",
      "lemma": "fast",
      "spoken_end": 4,
      "spoken_start": 0,
      "text": "fast"
    }
  ],
  "units": [
    {
      "content_hash": "sha256:b8518cae5461facce58d37b8105ad7b76cc6d2b766015520ba579ae2ba42651f",
      "id": "unit-0000",
      "index": 0,
      "kind": "paragraph",
      "marker_ids": [],
      "segment_ids": ["seg-000000"],
      "spoken_end": 4,
      "spoken_start": 0
    }
  ],
  "warnings": []
}
