{
  "annotations": [
    {
      "attrs": {
        "lang": "en-us"
      },
      "id": "annotation-000000",
      "kind": "language",
      "spoken_end": 9,
      "spoken_start": 0,
      "structural_end": 9,
      "structural_start": 0
    }
  ],
  "boundaries": [
    {
      "attrs": {
        "automatic": true
      },
      "id": "boundary-000000",
      "kind": "sentence",
      "origin": "planner",
      "position": 4,
      "seconds": null,
      "strength": "sentence"
    }
  ],
  "config": {
    "diagnostics": true,
    "document_format": "ssmd",
    "language": "en-us",
    "language_aliases": {},
    "linguistics": {
      "require_spacy": false,
      "spacy_model": null,
      "spacy_model_size": null,
      "use_spacy": null
    },
    "overlap_mode": "snap",
    "pauses": {
      "clause": 0.3,
      "enabled": true,
      "mode": "tts",
      "paragraph": 1.0,
      "parenthetical": 0.15,
      "sentence": 0.6,
      "voice_change": 0.15,
      "weak": 0.15
    },
    "ssmd": {
      "parse_header": true,
      "pause_defaults": null,
      "strict_header": true,
      "unknown_header": "warn"
    },
    "text_preparation": "spokenform",
    "unit": "sentence"
  },
  "diagnostics": [
    {
      "code": "planning.complete",
      "message": "Plan compiled without renderer or audio processing",
      "path": null,
      "severity": "info"
    }
  ],
  "document_metadata": {
    "header": {},
    "planning": {
      "engine_independent": true,
      "linguistic_passes": 2,
      "pass_a_tokens": 2
    }
  },
  "format": "utterplan",
  "languages": [
    {
      "id": "lang-0",
      "language": "en-us",
      "source": "explicit-span",
      "spoken_end": 9,
      "spoken_start": 0
    }
  ],
  "markers": [
    {
      "attrs": {
        "name": "mark"
      },
      "id": "marker-000000",
      "name": "mark",
      "spoken_position": 4
    }
  ],
  "plan_id": "sha256:6ce544f215dd98369140ad9c66ebee113201692e976e42f76e13d3dc1ac2f6c6",
  "preparation": {
    "backend": "spokenform",
    "languages": ["en-us"],
    "replacements": [],
    "version": "0.4.4.dev0+g71feb9cb4.d19800101",
    "warnings": []
  },
  "producer": {
    "name": "utterplan",
    "version": "0.1.0"
  },
  "schema_version": 1,
  "segments": [
    {
      "annotation_ids": ["annotation-000000"],
      "clause": 0,
      "directives": {},
      "id": "seg-000000",
      "language": "en-us",
      "paragraph": 0,
      "pause_after": {
        "events": ["boundary-000000"],
        "seconds": 0.6
      },
      "pause_before": {
        "events": [],
        "seconds": 0.0
      },
      "sentence": 0,
      "spoken_end": 4,
      "spoken_start": 0,
      "text": "One.",
      "token_indices": [0]
    },
    {
      "annotation_ids": ["annotation-000000"],
      "clause": 0,
      "directives": {},
      "id": "seg-000001",
      "language": "en-us",
      "paragraph": 0,
      "pause_after": {
        "events": [],
        "seconds": 0.0
      },
      "pause_before": {
        "events": [],
        "seconds": 0.0
      },
      "sentence": 1,
      "spoken_end": 9,
      "spoken_start": 5,
      "text": "Two.",
      "token_indices": [1]
    }
  ],
  "source": {
    "format": "ssmd",
    "text": "One. @mark Two."
  },
  "texts": {
    "spoken": "One. Two.",
    "structural": "One. Two."
  },
  "tokens": [
    {
      "id": "token-0",
      "language": "en-us",
      "lemma": "one.",
      "spoken_end": 4,
      "spoken_start": 0,
      "text": "One."
    },
    {
      "id": "token-1",
      "language": "en-us",
      "lemma": "two.",
      "spoken_end": 9,
      "spoken_start": 5,
      "text": "Two."
    }
  ],
  "units": [
    {
      "content_hash": "sha256:2331e548d1b1d34f1b4538cd689a80596b7939d64cd37ae858304fc6bc657148",
      "id": "unit-0000",
      "index": 0,
      "kind": "sentence",
      "marker_ids": [],
      "segment_ids": ["seg-000000"],
      "spoken_end": 4,
      "spoken_start": 0
    },
    {
      "content_hash": "sha256:16846267be8586f05733916c94416ab1573c4ae66320674f27f9928b1f742618",
      "id": "unit-0001",
      "index": 1,
      "kind": "sentence",
      "marker_ids": ["marker-000000"],
      "segment_ids": ["seg-000001"],
      "spoken_end": 9,
      "spoken_start": 5
    }
  ],
  "warnings": []
}
